Newspaper,Location,Date,Title,Text,Author,URL
Gannett Media Corp,"United States, Des Moines, Iowa","Nov 29, 2018",Inmates suing for right to porn: 58 plaintiffs seek to overturn new state ban,"Fifty-eight Iowa inmates are suing state officials in federal court, seeking $25,000 each in damages, claiming they have been denied a constitutional right to pornography in the state's prison system.
The lawsuit, filed in U.S. District Court in Des Moines, seeks to overturn a new state law that has shut down designated ""pornography reading rooms"" in Iowa's prisons. The law also prohibits inmates from having nude photos in their cells. The ban includes Playboy magazine, which has long been allowed in the state's nine prisons, which hold 8,575 inmates.
The plaintiffs — who are all inmates at the Fort Dodge Correctional Facility — are led by Allen C. Miles, 70, who is serving a life sentence for the stabbing death of Cheryl Kleinschrodt on March 3, 1982, in Des Moines. The suit claims the law was enacted under the guise of ""morality,"" and blames ""religious tyrants"" who have no regard for the U.S. Constitution or Declaration of Independence.
The lawsuit also contends that if female correctional officers employed in Iowa's prisons for men can't handle an environment that includes photographic matter featuring female nudity and related matters that ""they should find employment elsewhere.""
The suit was filed in late October and the changes took effect Nov. 14. U.S. Judge Robert Pratt in Des Moines has ordered each of the plaintiffs to pay a filing fee or to request that the fee be waived. He also told them to file a new complaint no later than Friday for the case to proceed.
The legislation — approved by the Iowa House and Senate and signed by Gov. Kim Reynolds — was part of a justice system budget bill approved at the end of the 2018 session.
The new law specifically says funds appropriated to the Iowa Department of Corrections shall not be used to distribute or make available any commercially published information or material to an inmate that is sexually explicit or features nudity.
The law reverses a policy in place for three decades since late Chief U.S. District Judge Harold Vietor upheld findings in 1988 that the state's prison rules on pornography were unconstitutionally vague and overbroad.
Michael Savala, the Iowa prison system's general counsel, told state lawmakers during the session the legislation mirrors a policy currently used by the Federal Bureau of Prisons. Iowa prison officials believe the changes will withstand a court challenge from inmates, he said.
""The department really feels that inmates having access to that kind of material does not lend itself to pro-social thinking and behavior and as far as our responsibilities to change the mindset of the offender as they transition back into the community,"" Savala said.
Prison officials also said the elimination of designated prison rooms in which inmates could read sexually oriented material ends a staff-intensive process. Under the old policy, offenders would check out publications and be escorted to a private reading area. When the inmate was finished examining the publication, the magazine would be returned to a staff person, who would inspect it to make sure no pages were been removed and no contraband was inserted into it.
In addition, prison officials said the population of sex offenders has grown significantly in Iowa's prisons since the 1980s and 1990s and prison officials want to keep sexually oriented publications away from them.
However, during Senate debate on the bill, Sen. Rich Taylor, D-Mount Pleasant, a retired Iowa State Penitentiary employee, opposed the legislation. He contended the changes ignore the fact that male inmates have a sexual drive.
""That is just a fact and you have to have some way to relieve that,"" Taylor said. ""This gives the inmates no release point except another offender, and don't think that it doesn't happen.""
Cord Overton, a spokesman for the Iowa Department of Corrections, said incarcerated individuals were advised in July that the changes would take effect in mid-November. That gave inmates four months to stop subscriptions to sexually explicit publications and to make arrangements with family and friends, he said.
CREDIT: William Petroski
Word count: 669","Petroski, William",https://www.proquest.com/usnews/docview/2139003909/citation/10F9BE4B85934515PQ/5?accountid=12826
"Tribune Publishing Company, LLC","United States, Chicago","Oct 17, 2017",Crest Hill latest to ban sale of pets from 'puppy mills' after Chicago ban upheld,"Crest Hill has become the latest Illinois community to limit where pet stores may obtain the animals they sell.
The city council in the southwest suburb voted unanimously to ban stores from offering pets obtained from large commercial breeders.
In doing so, Crest Hill joins a handful of other local governments - including Chicago, Cook County and Waukegan - that have enacted similar bans, aimed at prohibiting pet stores from selling animals from so-called puppy mills.
Entire states are also getting further involved in the regulation of pet sales. In August, Illinois Gov. Bruce Rauner signed a law banning large breeders from selling to pet stores unless the breeders are licensed by the USDA and have no violations. And last week, California enacted a law requiring pet stores to sell only animals obtained from shelters or animal rescue organizations.
Crest Hill’s ordinance was passed after the 7th U.S. Circuit Court of Appeals last month affirmed the city of Chicago’s right to enact a similar ban in 2015. The appeals court upheld a lower court’s ruling that dismissed a lawsuit challenging the legality of the ban filed against the city by two Chicago pet stores and a breeding firm in Missouri.
Crest Hill’s new law “is essentially banning puppy mill setups, so we’re talking about large scale breeders who are only breeding these (animals) to make money and then passing them off to pet stores,” City Administrator Heather McGuire said.
Under the local ordinance, pet stores can still sell animals but only if they’re from a nonprofit animal care facility, shelter or rescue organization. Consumers may still purchase animals directly from private breeders.
“We are not closing the door to anyone going to a private breeder to get a puppy,” McGuire said.
The ordinance is intended not only to reduce the demand for animals raised in large commercial settings, but also to protect unsuspecting consumers from purchasing an animal that may suffer from health or behavioral problems because of poor care or inbreeding.
“Often, these animals that come from these large commercial breeders have sickness, injury, inbreeding, and pet stores are putting these animals with buyers who don’t know they’ll end up with an animal that will require significant medical attention, and may often have to eventually be put down,” McGuire said.
Crest Hill has one pet store, Puppy in the Window, which relocated last year from Joliet.
The owners of Puppy in the Window could not immediately be reached for comment. McGuire said she believes the owners have decided to close the store, whose methods have been criticized by a local animal welfare organization, Safe Pets for Joliet.
Founder Morgan Drdak said measures such as the one passed in Crest Hill are not aimed at driving pet stores out of business, noting that only a small percentage of the tens of millions of dollars spent on the pet industry is for the purchase of animals themselves.
“The tide is turning,” Drdak said. “On Friday, the entire state of California did this. We’re not surprised, and we’re hoping that more communities - whether they have a pet store or not - will go ahead and be proactive. This is how we can make a difference, this is how we can shut down the puppy mills, this is how we can change the way that animals are treated when they’re bred.”
But Mike Bober, president of Pet Industry Joint Advisory Council, a national trade group representing the pet industry, said ordinances such as the one passed in Crest Hill may make it difficult for pet stores to source dogs from shelters and rescue groups if they refuse to work with the stores. Furthermore, he said the measures ignore the protections already offered to consumers.
“The biggest problem here is that breeders who sell through pet stores are licensed and regulated - that protection, that assurance regarding the source does not exist if you’re buying off of Craigslist or if you’re looking at a dog from a third-party source,” Bober said. “There are protections that people seem to overlook. ... And our concern is that in a desire to do something to address a legitimate concern, towns like Crest Hill are actually doing more harm than good.”
He also questioned why Crest Hill would move forward with the ordinance without giving the new Illinois law a chance to work.
“It seems to me that Crest Hill has unilaterally decided - even before that state law has had any chance to go into effect - that there is no such thing as a responsible breeder,” Bober said.
mwalberg@chicagotribune.com
Twitter @mattwalberg1
Credit: Matthew Walberg
Word count: 769","Walberg, Matthew",https://www.proquest.com/usnews/docview/1952061407/abstract/10F9BE4B85934515PQ/6?accountid=12826
Reason Foundation,"United States, Washington","Sep 3, 2020","FOSTA Is Unconstitutional, Argue Sexual Freedom Advocates and First Amendment Lawyers in New Motion: Plus: People have doubts about democracy, Washington state sues Juul, and more...","The Woodhull Freedom Foundation is suing (again) to get FOSTA ruled unconstitutional. FOSTA—the 2018 ""human trafficking"" law making it a federal crime to host digital content that promotes prostitution—violates the First and Fifth Amendments, says Woodhull's motion for summary judgment, filed in federal court on August 31. It also takes aim at the law's retroactive scope—FOSTA says you can be punished for violating it even before the law went into effect.
The suit comes after a federal district court dismissed an earlier filing against FOSTA, brought by Woodhull—a nonprofit dedicated ""to affirm[ing] and protect[ing] sexual freedom as a fundamental human right""—and fellow plaintiffs The Internet Archive, Human Rights Watch, Eric Koszyk, and Alex Andrews. In January, a federal appeals court reversed the decision and sent the case back to the district court.
You can find their full motion for summary judgment here (and find previous court filings here). ""Plaintiffs request a declaratory ruling that FOSTA is unconstitutional and a permanent injunction against its enforcement and application,"" the motion states. They claim that ""FOSTA is unconstitutionally vague and overbroad, is a content-based statute that cannot satisfy strict scrutiny, and lacks the necessary scienter requirements to be constitutional"" (scienter refers to a person's intent when doing something that the government claims is criminal). ""And it explicitly is meant to have retroactive reach in both its criminal and civil applications.""
Meanwhile, the SAFE SEX Workers Study Act, introduced by Rep. Ro Khanna (D-Calif.) to pave the way for FOSTA's dismantling, has gone nowhere since its introduction last December. Several civil lawsuits—two against Craigslist and one against Mailchimp—are invoking FOSTA in order to accuse these tech companies of being legally liable for ""sex trafficking.""
Woodhull and the other plaintiffs are represented by Lawrence G. Walters of the Walters Law Group, Bob Corn-Revere of Davis Wright Tremaine, and the Electronic Frontier Foundation (EFF).
------------
FREE MINDS
Doubts about democracy. A new Pew Research Center poll of Americans finds that ""among the public overall, 68% say it is very important for the country that people are free to peacefully protest, down from 74% two years ago. In this case, the decline has come entirely among Republicans,"" Pew notes.
The poll was conducted from July 27 through August 2 and consisted of 11,001 U.S. adults.
A majority of those surveyed (62 percent) agreed ""that significant changes are needed in the fundamental design and structure of American government to make it work for current times."" Pew points out that ""while views among the public overall have changed little since 2018, Democrats and Republicans have moved further apart in their opinions. Currently, 79% of Democrats say significant changes in the structure of government are needed, compared with 41% of Republicans.""
------------
FREE MARKETS
Washington state files consumer protection lawsuit against Juul. Taking a page from the anti-tobacco playbook, the attorney general of Washington state is accusing vaping company Juul of ""designing and marketing its products to appeal to underage consumers and deceiving consumers about the addictiveness of its product."" Here's the kind of laughable claims the state is making to back up this assertion: ""JUUL's advertising used sharp patterns, bright colors and young models.""
------------
QUICK HITS
Breaking: In a long-awaited decision, the 9th Circuit has ruled that the NSA's bulk collection of Americans' call records was illegal.
The court held that the mass surveillance program violated Section 215—and very likely violated the 4th Amendment too.https://t.co/fMNUYdkttm
— Patrick Toomey (@PatrickCToomey) September 2, 2020
• ""In 2013, my amendment to stop the NSA's unconstitutional metadata surveillance program was narrowly defeated,"" noted Rep. Justin Amash (L–Mich.) on Twitter. ""Multiple Congresses, Obama, and Trump renewed the program until it finally lapsed this year. Today, the 9th Circuit ruled the program illegal.""
• Trump is ordering federal agencies to report to the White House Office of Management and Budget how they can move to redirect federal funds away from what Trump calls ""lawless"" cities: New York City, Portland, Seattle, and Washington, D.C.
President Trump signed a memo today to restrict federal $ from going to ""anarchist jurisdictions"" - the memo cites Seattle, Portland, NYC & D.C.
Per the memo, below is how DOJ is supposed to determine what the ""anarchist jurisdictions"" are: pic.twitter.com/kJXVvehEMm
— Jeff Stein (@JStein_WaPo) September 3, 2020
• D.C. police fatally shot a young black man in the back as he was running away from them. Deon Kay had just turned 18, according to his family. Police say they were called to the area ""to investigate a man with a gun"" and ""upon arrival, officers encountered individuals in and around a vehicle."" When two of the men, including Kay, saw police and tried to leave the scene, the cops pursued and shot at them, killing Kay.
This distraught family earlier confirmed to The Post that the victim was Deon Kay, who just turned 18.
""They took my baby, they just took my baby from me,"" said his mother, Natasha. ""I need my son back, I want my son back."" pic.twitter.com/30d0HKs6hy
— Michael Brice-Saddler (@TheArtist_MBS) September 3, 2020
• Mike Masnick of Techdirt checks in on some of the public comments to the Federal Communications Commission about Section 230; start here:
Randomly clicking on FCC 230 comments, and the first one I pick… of course has the ""but platform v. publisher!"" Disinformation continues to work… pic.twitter.com/1OfI5ivlQk
— Mike Masnick (@mmasnick) September 2, 2020
• Social unrest may not be helping President Donald Trump as much as his folks think it will:
The head-turning number in this new Fox poll: Taken entirely after Kenosha unrest, it has Trump down 5 points in Wisconsin on ""policing and criminal justice."" https://t.co/TNTGHqFIj5 pic.twitter.com/cUH94kbkRY
— Dave Weigel (@daveweigel) September 2, 2020
Word count: 945",Elizabeth Nolan Brown,https://www.proquest.com/usnews/docview/2786749652/citation/10F9BE4B85934515PQ/7?accountid=12826
