Newspaper,Location,Date,Title,Text,Author,URL
POLITICO LLC,"United States, Arlington","Jul 12, 2019",The Trump Bill of Rights,"President Donald Trump came close to rewriting the First Amendment while speaking to the kennel’s worth of right-wing lapdogs, trolls, conspiracy theorists and media hackers he convened at the White House on Thursday for his “Social Media Summit.”
Saying that Google, Facebook and Twitter were guilty of “discriminating against conservatives,” Trump vowed that “all regulatory and legislative solutions” available to the federal government would be used against the companies “to protect free speech.”
Rather than defining free speech in positive terms, Trump explained what free speech isn’t. “To me free speech is not when you see something good and then you purposefully write bad,” Trump said. “To me that’s very dangerous speech and you become angry at it. But that’s not free speech.”
If Trump thinks negative and critical commentary don’t qualify as free speech because they’re “dangerous” and make him “angry,” he’s reversed the First Amendment, which was designed to protect the right to say bad things about “good” things. It’s easy to imagine that Trump’s complete revision of the First Amendment would define freedom of religion as the right to attend a church of Trump’s choice, that the right to assembly was reserved only for people attending MAGA rallies, and that the freedom of the press belongs to those who praise Trump.
Following Trump’s idea to its logical extremes, what would the Bill of Rights look like if he applied the same judicial oomph to the other original amendments to the Constitution? Rewriting the Second Amendment to Trump's satisfaction could be done with just a few word changes. Rather than having a right to bear arms, the Trump rewrite would make gun ownership a duty. This isn’t far from Trump’s real-life position. In a June interview, he all but called for universal armament when he said that unarmed civilians were “sitting ducks.”
The Third Amendment, which forbids the military from using citizens’ homes as crash pads without consent, is the least controversial of all the amendments. Trump, who worships the military, could own the libs with a rewrite stating that the soldiers working on the Mexican border must lodge in nearby private residences. Homeowners who find themselves overcrowded by their military lodgers would be allowed to temporarily reside in our luxurious and spacious migrant detention centers.
Given the fury he directed at special counsel Robert Mueller and the FBI for their investigations, I imagine that Trump would fork the Fourth Amendment into a two-parter. His enemies would have no protections against unreasonable searches and seizures. If you haven’t done anything wrong, you have nothing to hide. But searches directed against obviously innocent people like Trump and his associates would be forbidden. Remember his wailing in April 2018, after the FBI served a lawful search warrant on his then-attorney, Michael Cohen? Trump characterized the search, which helped secure a guilty plea from Cohen, as worse than a break-in. “It's an attack on our country,” Trump said. “It’s an attack on what we all stand for.”
Trump’s Fifth Amendment makeover would likely toss the “takings” clause. He's a long-term abuser of eminent domain; he believes that property owners have no right to keep their homes and businesses when he wants to buy them. But what to do about the right against self-incrimination enshrined in the amendment? Keep it as is? Maybe the best way out would be to privatize self-incrimination rights by allowing individuals to sign binding nondisclosure agreements with themselves.
The Sixth Amendment right to a speedy trial would be reversed, informed by Trump’s history of dragging his feet in civil cases. Trump loves to sue, and because he’s such a deadbeat, his contractors tend to sue him back. The way Trump sees it, the longer the litigation, the greater chance his opponent will back down. In the famous Tesoro case, Trump’s attorney told architect Andrew Tesoro that he might win the lawsuit he had filed against Trump, but the mogul would make certain the case would last so long that he’d go bankrupt in the process.
The Seventh Amendment, which guarantees civil jury trials in federal court, would probably attract no interest from Trump. But the Eighth, which prohibits cruel and unusual punishment would be trash-canned. He’s a proponent of torture, water boarding and other methods of “enhanced interrogation,” saying it “works.” In 1989, he called for the death penalty after a group of teenagers was charged with a Central Park rape. (The teenagers were later exonerated.)
I will leave Trumpian reformation of the Ninth Amendment, which Judge Robert Bork once compared to an impenetrable “inkblot,” to legal scholars. The Ninth might be the only Bill of Rights amendment in dire need of actual freshening, Trump or no Trump. It’s unlikely that Trump would take issue with the Tenth, which establishes the concept of federalism. So instead of rewriting the last two amendments, the unshackled Trump would probably award himself the wild card of an additional amendment to the Bill of Rights. Its wording: “If an incumbent president loses office in a reelection campaign, he shall not be removed from the White House without his consent.”
******
Maybe a 12th Amendment prohibiting impeachment? Send your Trumpian amendments via email to Shafer.Politico@gmail.com. My email alerts disagree with Trump's statement that ""nobody ever mentions Article II"" of the Constitution—my Twitter feed can’t stop talking about it. My RSS feed pines for the Articles of Confederation.
Word count: 891","Shafer, Jack",https://www.proquest.com/usnews/docview/2256232556/citation/10F9BE4B85934515PQ/1?accountid=12826
WP Company LLC d/b/a The Washington Post,"United States, Washington, D.C.","Jun 1, 2017",Md. gerrymandering lawsuit could impact 2018 voting map: The plaintiffs' attorneys have asked a federal court to quickly declare the existing map unconstitutional or bar state officials from enforcing it for the 2018 election.,"Seven individuals challenging Maryland's 6th Congressional District as unconstitutional are asking a federal court to overturn the state's voting map or block officials from using it in the 2018 election.
John Benisek, a resident of Williamsport, and other residents allege that gerrymandering by Maryland Democrats during the 2010-2011 redistricting process violated their First Amendment rights, diminishing the ability of Republicans to elect candidates of their choice for the congressional seat now held by Rep. John Delaney (D).
Plaintiffs' attorneys deposed some of the state's leading Democrats, including former governor Martin O'Malley, who said he felt a responsibility to make the seat more winnable for Democrats. The seat was held at the time by Roscoe Bartlett (R), and O'Malley led the redistricting effort.
On Wednesday, the attorneys filed a motion asking a three-judge panel with the U.S. District Court in Maryland to declare the map unconstitutional or issue a preliminary injunction blocking the state from enforcing it, arguing that ""any further delay risks irreparable injury with respect to the forthcoming 2018 election.""
The plaintiffs are arguing that Democratic state officials who designed the district relied heavily on advanced mapping software, voter-registration data and voting history to give an advantage to their party.
When asked whether he thought the revised district would help Democrats, O'Malley said in his deposition that it ""was certainly my hope, and it was part of my intent.""
O'Malley said state legislative leaders who took part in the redistricting process, including House Speaker Michael E. Busch (D-Anne Arundel) and Senate President Thomas V. Mike Miller Jr. (D-Calvert), had the same intentions.
But Miller and Busch, in their depositions, said they did not seek to flip the district to the Democratic column. ""I voted for and supported what I would believe was in the best interest of the citizens of the state,"" Busch said.
Miller and Busch said they were largely unfamiliar with the data given to their staffs during the redistricting process, including metrics showing the chances of Democrats winning districts under various configurations.
""I didn't even review it,"" Miller said. ""It wasn't important to me.""
In redrawing the 6th Congressional District, state officials moved more than 360,000 residents out of the district and a roughly equal number of people into it.
Before the change, Republicans made up nearly 47 percent of registered eligible voters within the boundaries, compared with about 36 percent for Democrats. After the new lines were enacted, Republicans made up 33 percent of registered eligible voters in the district, compared with 44 percent for Democrats.
The Cook Political Report's partisan voter index, which estimates the propensity for districts to vote Democratic or Republican, showed that the 6th Congressional District flipped from an R+13 in 2010 to a D+2 in 2011, the largest swing in the nation that year.
""There is no plausible explanation for the wholesale geographic, demographic, and political reshuffling of the Sixth District other than the attempt to dilute Republican votes to make it impossible for them to reelect Roscoe Bartlett,"" the plaintiffs' attorneys said.
Bartlett, who had consistently won reelection in the district by double-digit margins over two decades, lost the 2012 election to Delaney.
The result gave Democrats seven of Maryland's eight congressional seats. They previously controlled six.
The plaintiffs' attorneys claim that many constituents in and around the 6th District have been ""chilled from participating in the political process, not only because they feel that voting is a lost cause in light of gerrymandering, but also because they feel disconnected from their congressional district.""
During the depositions, Miller was asked about talking points his staff had provided for various speaking engagements at Democratic events. One of the items said the revised 6th District ""gives Democrats a real opportunity to pick up a seventh seat in the delegation by targeting Roscoe Bartlett.""
Another memo said: ""If asked about redistricting, keep it simple. We're going to do our best to help Democrats, while following all of the applicable federal and state constitutional and statutory requirements.""
Miller played down the talking points, saying he generally speaks off the cuff during speeches. He described the notes as ""political rhetoric"" designed to inspire Democrats and not necessarily guiding principles for the redistricting process.
The case is Benisek v. Lamone.
josh.hicks@washpost.com
Word count: 706","Hicks, Josh",https://www.proquest.com/usnews/docview/1904749445/citation/10F9BE4B85934515PQ/3?accountid=12826
